{
  "schema_version": 1,
  "kind": "character_state",
  "message_id": "0199a0c0-0000-7aaa-8000-000000000005",
  "sent_at": "2026-10-03T17:04:09Z",
  "sequence": 16,
  "payload": {
    "character_revision": 41,
    "session_id": "0199a0c0-0000-7aaa-8000-0000000055e1",
    "state": "speaking",
    "gaze_x": -0.2,
    "gaze_y": 0.1,
    "speech_energy": 0.72,
    "motion_scale": 1
  }
}
